{
  "schema_version": "local-preview-session/v1",
  "session_id": "AKALYNTH_PREVIEW_ROOKGUARD_KIT_V1",
  "draft_manifest_ref": "codex/samples/rookguard-builder-draft-manifest.sample.json",
  "started_utc": "2026-06-23T01:05:00Z",
  "ended_utc": "2026-06-23T01:12:00Z",
  "preview_only": true,
  "artifacts": {
    "manifest_checksum": "490990e212156a691ecbbe128a5b346296a91efac46f04ac2ce41f8b81d11dcc",
    "replay_log_ref": "builder/previews/rookguard-kit-v1/replay.jsonl",
    "screenshots": [
      "builder/previews/rookguard-kit-v1/guild-hall-annex-before.png",
      "builder/previews/rookguard-kit-v1/guild-hall-annex-after.png",
      "builder/previews/rookguard-kit-v1/gate-overlook-after.png"
    ],
    "abuse_review_note": "Preview session emitted preview_only receipts; no chronicle writes."
  },
  "receipt_expectations": [
    {
      "receipt_type": "preview_session_start",
      "lane": "preview_only"
    },
    {
      "receipt_type": "preview_manifest_checksum",
      "lane": "preview_only"
    },
    {
      "receipt_type": "preview_session_end",
      "lane": "preview_only"
    },
    {
      "receipt_type": "gate_unlock",
      "lane": "live",
      "note": "Expected only after operator promotion and live player actions — not in preview."
    }
  ],
  "non_claims": [
    "Preview session is not an authority source.",
    "No live lane writes occurred during this sample session."
  ]
}
